{
  "$schema": "./rev_a_profile_v1.schema.json",
  "profileId": "revA-1t-1-5-30",
  "profileCode": 1,
  "version": { "major": 1, "minor": 0 },
  "task": {
    "maxTasks": 1,
    "maxProgramsPerTask": 1,
    "maxProgramsTotal": 1,
    "allowedPeriodMs": [1000, 5000, 30000]
  },
  "resources": {
    "maxSourceBytes": 65536,
    "maxVariables": 512,
    "maxStatements": 4096,
    "maxFbdBlocks": 256,
    "maxFbdConnections": 512,
    "maxArtifactBytes": 1048576,
    "maxInstructions": 4096,
    "maxSlots": 1024,
    "maxWritableSlots": 512,
    "maxConstants": 512,
    "maxFunctionBlocks": 64,
    "maxBindings": 256,
    "maxRetainVariables": 128,
    "maxRetainBytes": 4096,
    "maxSections": 16
  },
  "languages": ["ST", "FBD"],
  "types": [
    { "name": "BOOL", "widthBits": 1, "wireCode": 1, "conversion": "EXPLICIT_FAIL_CLOSED" },
    { "name": "INT", "widthBits": 16, "wireCode": 5, "conversion": "EXPLICIT_FAIL_CLOSED" },
    { "name": "DINT", "widthBits": 32, "wireCode": 2, "conversion": "EXPLICIT_FAIL_CLOSED" },
    { "name": "UINT", "widthBits": 16, "wireCode": 6, "conversion": "EXPLICIT_FAIL_CLOSED" },
    { "name": "REAL", "widthBits": 32, "wireCode": 3, "conversion": "EXPLICIT_FAIL_CLOSED" },
    { "name": "TIME", "widthBits": 64, "wireCode": 4, "conversion": "EXPLICIT_FAIL_CLOSED" }
  ],
  "pointKinds": ["LOCAL", "VP", "MB_RTU"],
  "coreLibrary": {
    "version": "rev-a.1",
    "functions": [
      "AND", "OR", "XOR", "NOT", "EQ", "NE", "LT", "LE", "GT", "GE",
      "ADD", "SUB", "MUL", "DIV", "MOD", "ABS", "MIN", "MAX", "LIMIT",
      "SEL", "TON", "TOF", "R_TRIG", "F_TRIG", "CTU", "SCALE", "DEADBAND",
      "PI", "PID"
    ]
  },
  "integrityMode": "HASH_ONLY"
}
